{
  "name": "Sample 001c Trajectory",
  "description": "Initial state + sequence of events. Engine applies events and produces updated elements or ephemeris.",
  "epoch": "2026-10-24T00:00:00Z",
  "centralBody": "Sun",
  "frame": "ICRS",
  "initialElements": {
    "type": "keplerian",
    "a": 1,
    "e": 0,
    "i": 0,
    "raan": 0,
    "argp": 0,
    "nu": 0,
    "units": {
      "a": "AU",
      "angles": "deg"
    }
  },
  "events": [
    {
      "id": "earth-departure",
      "type": "burn",
      "deltaV_km_s": 3,
      "direction": "prograde",
      "notes": "Chemical stage"
    },
    {
      "id": "solar-oberth",
      "type": "oberthBurn",
      "perihelion_AU": 0.1,
      "deltaV_km_s": 5,
      "notes": "Deep solar burn — Oberth multiplier applied by engine",
      "direction": "prograde"
    },
    {
      "id": "tether-1",
      "type": "tetherRelease",
      "deltaV_km_s": 2.5,
      "notes": "Momentum exchange",
      "direction": "prograde"
    },
    {
      "id": "hitchhike-1",
      "type": "hitchhike",
      "deltaV_km_s": 0.1,
      "direction": "prograde"
    },
    {
      "id": "jupiter-assist",
      "type": "gravityAssist",
      "body": "Jupiter",
      "periapsis_km": 100000,
      "turnAngle_deg": 30
    }
  ],
  "targetAsymptotic_km_s": 300
}
